affiliation,author_name,author_id
"Departments of Biol. Sci., Seoul Natl. Univ., Seoul, Korea, Republic of",B.-K. KAANG,5197
"Univ. of Glasgow, Glasgow, United Kingdom; ",D. I. HUGHES,11000
"Dept. of Integrative Biol. and Physiol., Univ. of California Los Angeles, Los Angeles, CA; ",Y. GERASIMENKO,5731
"Pediatrics, ",H. KIM,4091
"American Univ., Washington, DC; ",M. LAUBACH,6586
"Rockefeller, New York, NY; ",H. MOLINA,10775
"RIKEN BSI, Saitama, Japan; ",T. C. SAIDO,5249
"Neurobio. and Anat., Univ. of Utah, Salt Lake City, UT; ",J. D. SHEPHERD,9306
"Fudan Univ., Shanghai, China; ",Y. CHEN,3295
"Massachusetts Gen. Hosp., Charlestown, MA; ",S. DEVOS,11505
"Dept Integrative Biol. & Physiol., Univ. of California Los Angeles, Los Angeles, CA; ",V. EDGERTON,5734
"Psychology, ",P. A. SERRANO,6759
"Pharmacol., ",Q. ZHANG,3141
"CINAC, Univ. Hosp. HM Puerta Del Sur, Mostoles, Spain; ",J. A. OBESO,11
"Ctr. for Neural Sci., New York Univ., New York, NY; ",E. KLANN,9531
"Neurosciences, Univ. of New Mexico HSC, Albuquerque, NM; ",N. PERRONE-BIZZOZERO,10071
"Neurosci., Icahn Sch. of Med. At Mount Sinai, New York, NY; ",Y. LU,3522
"Neurosci., Icahn Sch. of Med. At Mount Sinai, New York, NY; ",L. A. FARRELLY,10774
"Mayo Grad. Sch., Mayo Clin., Rochester, MN",P. GRAHN,1016
"Univ. North Carolina, Chapel Hill, NC; ",L. M. TARANTINO,9794
"Pharmacodynamics, ",C. J. FRAZIER,5505
"Dent., ",A. LEBOUCHER,7358
"Dept. of Pharmacol. & Toxicology, ",Z. LIU,6095
"Dept Pharmacol, ",S. F. TRAYNELIS,6440
"Neurosciences, Univ. of California - San Diego, La Jolla, CA; ",M. H. TUSZYNSKI,1528
"Dept. of Pharmacol. and Toxicology, The State Univ. of New York at Buffalo, Buffalo, NY; ",C. WERNER,10149
"Childrens Hosp. Kirby Ctr., Childrens Hosp., Boston, MA",B. A. STEVENS,2623
"MBNI/Physiology, ",G. G. MURPHY,4225
"Neurol., ",R. KAYED,6821
"Dept. of Neurolog. Surgery, ",J. MORIMOTO,5232
"Neurol. Res., Henry Ford Hosp., Detroit, MI; ",M. CHOPP,4427
"Behavioral & Brain Sci., Univ. of Texas at Dallas, Richardson, TX; ",B. P. RYPMA,8796
"Columbia Univ., New York, NY",R. YUSTE,3090
"Korea Inst. of Oriental Med., Daejeon, Korea, Republic of",J. KIM,2566
"LN/NIMH, NIH, Bethesda, MD",B. J. RICHMOND,6252
"Lab. of Mol. and Cell. Neurosci., The Rockefeller Univ., New York, NY",P. GREENGARD,7809
"APC Microbiome Inst., ",T. G. DINAN,1972
"Neurosciences, ",J. P. WEICK,6483
"Britton Chance Ctr. for Biomed. Photonics, Huazhong Univ. of Sci. and Technol., Hubei, China; ",S. LI,2736
"Evelyn F. McKnight Brain Inst., ",A. P. MAURER,10037
"Icahn Sch. of Med. at Mount Sinai, New York, NY; ",B. J. HARTLEY,2256
"Princeton Univ., Princeton, NJ",J. D. COHEN,4075
"Discovery, Charles River, Saffron Walden, United Kingdom",D. F. FISCHER,975
"Psychology and Neurosci., ",L. R. WATKINS,7831
"Ctr. for Dementia Res., Nathan Kline Inst., Orangeburg, NY; ",M. J. ALLDRED,1130
"Dept Neurosurg., Emory Univ. Sch. Med., Atlanta, GA; ",R. E. GROSS,5147
"Integrative Biol. and Physiol., ",H. ZHONG,5729
"Univ. of South Carolina, Columbia, SC; ",J. C. STEWART,8721
"Pusan Natl. Univ., Pusan-City, Korea, Republic of; ",J. YANG,3950
"Psychiatry, Univ. of Pittsburgh, Pittsburgh, PA; ",R. W. LOGAN,4604
"Neuropsychiatry, ",D. R. ROALF,8162
"Seoul Natl. Univ., Seoul, Korea, Republic of",J. SHIM,6133
"Psychiatry, Univ. of Pittsburgh, Pittsburgh, PA",D. A. LEWIS,9186
"Dept. of Anat., ",S. SEO,9363
"Biomed. Engin., Univ. of Michigan, Ann Arbor, MI; ",C. A. CHESTEK,2617
"Natl. Inst. on Drug Abuse, Baltimore, MD",M. VENNIRO,9026
"Dept. of Physiology, Feinberg Sch. of Med., Northwestern Univ., Chicago, IL; ",A. CONTRACTOR,5652
"Pharmacol. and Physiol., ",D. W. MEECHAN,5675
"Dept. of Clin. Neurosci., Lausanne Univ. Hosp. (CHUV), Lausanne, Switzerland; ",J. BLOCH,6698
"Dept. of Pharmacology, Feinberg Sch. of Med., Northwestern Univ., Chicago, IL; ",Y. WANG,2844
"Psychology, Binghamton Univ., Binghamton, NY",C. BISHOP,4562
"Stark Neurosciences Res. Inst., Indianapolis, IN",B. T. LAMB,7341
"Neurosci., ",Z. S. LORSCH,7598
"Sackler Program for Epigenetics and Psychobiology, ",M. J. MEANEY,561
"Neurosci., Icahn Sch. of Med. At Mount Sinai, New York, NY; ",I. MAZE,4179
"Neurobio., ",H. LI,3427
"Dept. of Genetics, Yale Sch. of Med., New Haven, CT; ",Y. TANAKA,10843
"Res. Programs, The Michael J. Fox Fndn. For Parkinson's Res., New York, NY; ",K. D. DAVE,4403
"Univ. Federal Do Paraná, Curitiba, Brazil; ",R. ANDREATINI,5097
"Brain Res. Ins Niigata Univ., Niigata, Japan; ",K. SAKIMURA,9257
"Cell. Neurobiol, Brain Res. Inst, Niigata Univ., Niigata, Japan",M. ABE,7531
"Dept. of Psychology, Univ. of New Mexico, Albuquerque, NM",B. J. CLARK,4805
"DIRP, NIMH, NIH, Clin. and Translational Neurosci. Br., Bethesda, MD; ",III,3019
"Neurobio., Barrow Neurolog. Inst., Phoenix, AZ; ",P. WHITEAKER,5645
"MIBR/BCS, MIT, Cambridge, MA",J. YANG,3952
"Res. Group Mol. Mechanisms of Synaptic Function, Max Planck Florida Inst., Jupiter, FL; ",JR,2469
"Inst. of Pharmacol. and Toxicology, UZH, Zuerich, Switzerland",S. K. TYAGARAJAN,2487
